{
  "schema_version": 1,
  "recorded_at": "2026-08-20",
  "evidence_commit": "4a30c7fa9240f63cde1a5f3a5cedcbd9bd8b79c5",
  "evidence_commits": [
    "4a30c7fa9240f63cde1a5f3a5cedcbd9bd8b79c5",
    "8149f42f2694c200ca9fae37875c4dba4e727978",
    "b07c410fb43ad5953f83d3a6847dcd452b0b48d7",
    "00491aae2ab43c486f3a9b4a62ce3ba5e63032f6",
    "c8d4f7ce984ec0107846b2c7aa398cb1141caf39",
    "3a6acc625abe99d977d2b225eaae63f8ffe02c65",
    "da6b0c128210b2cd44a7a2c5a120b08e942de9ce",
    "b845ccf2694ce8931814785522bacfe16abe4c01",
    "fa8fd58bdc6cf098792cde3ff7416a0780647b5a"
  ],
  "snapshot_notes": [
    "The reviewed inactive promotion at finance commit 00491aa and orchestrator commit c8d4f7c verified 21 workflows, zero active, zero published, eight folders, 63 tag edges, four Outlook bindings, and 13 OneDrive bindings without changing credential ciphertext or calling providers.",
    "Official n8n DataTableService readback verified all 15 exact operational Data Tables, seven AI policy rows, nine commit-bound configuration rows, and preservation of the existing source-cursor row; no direct SQL bootstrap or finance-system write was used.",
    "The internal runtime health check passed for n8n, the task broker, task launcher, and bounded Codex runner. The transient WF23 run completed bounded Outlook and OneDrive reads and moved both expired access-token expiries into the future, but restart persistence and the required second reads did not run.",
    "WF23 is currently stranded as one inactive, unpublished setup workflow with one soft-deleted running execution row. The observed project boundary is temporarily 22 workflows, zero active, zero published, 22 placements, and 66 tag edges; exact reviewed cleanup back to 21/0/0 and zero WF23 rows is pending.",
    "The setup-only OneDrive root workflow remains manual-only and outside the regular 21-workflow corpus. Its attempted live run failed at a clean restored boundary; exact create-or-reuse and root-folder readback remain unproven.",
    "The host runtime registers pinned ProDex 0.5.1 and Claude 0.8.0 community packages, eight nodes, and three credential types. Subscription authentication and schema-bound execution remain unproven.",
    "Outlook filtering, attachment preservation, and original-email JSON archival are repository-tested. Inline-email PDF rendering still needs a fixed local renderer and runtime proof.",
    "Claude cache discovery succeeded; Codex startup failed because the pinned CLI cannot parse the shared newer agent-role configuration. ProDex needs an isolated compatible authentication home or device login before structured execution can be claimed.",
    "b845ccf records a guarded 45-manifest, 3,927-identity Actual dry run with 400 proposed exact-state changes, zero amount mutations, 28 preserved manual-category conflicts, and 15 snapshot-absent identities. No disposable Actual replay or production write occurred.",
    "The independent 3a6acc6 readiness audit still keeps the ADCB issuer-balance contradiction, duplicated Finance Evidence paths, missing warranty and property metadata, and missing fresh wealth and FX evidence open. Production activation and finance writes remain forbidden pending their separate acceptance gates.",
    "One batched 1Password update to FinanceAutomation/n8n-runtime preserved existing fields, concealed the secret, and left Bellwether untouched. Retained Postgres rotation and n8n key recovery completed; cold-start injection, persistence/log scanning, and backup restore remain open."
  ],
  "resolved_blockers": [
    "CURRENT_TEST_FAILURE",
    "CURRENT_TEST_FAILURES",
    "CURRENT_TEST_SUITE_FAILURES",
    "CURRENT_N8N_TEST_FAILURE",
    "UNCOMMITTED_REFACTOR",
    "DISPOSABLE_N8N_REQUIRED",
    "OAUTH_WORKFLOW_BINDING_AND_READBACK_REQUIRED",
    "RUNTIME_COMMIT_DRIFT_RECONCILIATION_REQUIRED",
    "RUNTIME_ENUMERATION_REQUIRED",
    "CI_HOST_SSH_UNAVAILABLE",
    "IMPORTED_FOLDER_AND_CANVAS_REVIEW_REQUIRED",
    "RETAINED_MOUNT_MISMATCH_BLOCKS_RUNTIME_PROMOTION",
    "DEDICATED_VAULT_REQUIRED"
  ],
  "superseded_text_markers": [
    "35/36 passing",
    "350 passed, 1 failed",
    "14/16 passing",
    "The refactor is uncommitted",
    "Stabilize generated/bootstrap contracts",
    "Repair provider-envelope contract/test parity",
    "current contract bytes fail their local suite"
  ],
  "updates": [
    {
      "id": "N8N-001", "status": "IMPLEMENTED_UNVERIFIED",
      "implementation_state": "DEPLOYED_INACTIVE", "verification_state": "RUNTIME_INACTIVE_IMPORT_BINDING_SCHEMA_AND_HEALTH_VERIFIED",
      "evidence_paths": ["integrations/n8n/pipeline-registry.json", "runtime/n8n-orchestrator-repo/docs/receipts/disposable-n8n-fa8fd58-20260819/cli-runtime-receipt.json", "/opt/disposable/finance-n8n/20260819155134/receipts/inactive-00491aae2ab4-20260819T221734Z.json", "/opt/disposable/finance-n8n/20260819155134/receipts/runtime-health.json"],
      "tests": ["n8n workflow, runner-closure, and task-runner-image focus: 50 run, 6 skipped", "codex-agent-runner npm: 16 of 16 pass", "full Python: 381 run, 6 skipped", "reviewed inactive promotion c77eaeb08d36aa82e978c1f3c4b8414d8604b0a2899a661d73a3b5dd4c6fb45d: 21 workflows, 0 active, 0 published, 8 folders, 63 tag edges", "runtime health 3daf8d8acdc4a4032121d34219a82554114ef1853a17dadd66d5ebb6043c7ca4: n8n, task broker, task launcher, and Codex runner passed"],
      "live_readback": "Internal n8n 2.36.2 at finance commit 00491aa and orchestrator commit c8d4f7c has 21 workflows, zero active, zero published, eight folders, 63 tag edges, four Outlook bindings, 13 OneDrive bindings, 15 exact Data Tables, seven AI policy rows, and nine config rows. Runtime health passed; no provider, Actual, or cashback call occurred.",
      "remaining_work": "Remove the exact WF23 orphan, complete Microsoft restart persistence, execute the fixture matrix twice, and prove issuer schedules before any activation.",
      "blockers_remove": [], "blockers_add": ["DISPOSABLE_DOUBLE_REPLAY_REQUIRED"],
      "last_verified": "2026-08-20", "next_action": "Remove the exact WF23 orphan, then complete the guarded Microsoft restart and second-read proof while all workflows remain inactive."
    },
    {
      "id": "N8N-002", "status": "PARTIAL",
      "implementation_state": "DEPLOYED_INACTIVE", "verification_state": "RUNTIME_SIBLING_PLACEMENT_VERIFIED_TARGET_APPLICATION_HIERARCHY_PENDING",
      "evidence_paths": ["integrations/n8n/refactor_workflow_ui.py", "integrations/n8n/workflow-folders.json", "/opt/disposable/finance-n8n/20260819155134/receipts/inactive-00491aae2ab4-20260819T221734Z.json"],
      "tests": ["workflow renderer, group, folder, readability, and idempotence tests pass", "runtime readback verified 8 folders, 21 placements, and 63 tag edges"],
      "live_readback": "All 21 workflows are imported inactive and unpublished in eight folders with 63 tag edges. Manual coordinate cleanup and Tidy Workflow are deferred to the user; semantic names, notes, and section contracts remain repository-tested.",
      "remaining_work": "Complete remaining workflow semantics and implement the reviewed Finance application root and role hierarchy after setup proofs and N8N-011 design; manual coordinate optimization is out of scope.",
      "blockers_remove": [], "blockers_add": ["APPLICATION_SCOPED_ROLE_HIERARCHY_REQUIRED"],
      "last_verified": "2026-08-20", "next_action": "Complete setup proofs and N8N-011 first, then implement N8N-010; use Tidy Workflow only for optional coordinate cleanup."
    },
    {
      "id": "N8N-003", "status": "PARTIAL",
      "implementation_state": "DEPLOYED_INACTIVE", "verification_state": "MICROSOFT_FIRST_READ_AND_REFRESH_OBSERVED_RESTART_PERSISTENCE_PENDING",
      "evidence_paths": ["integrations/n8n/workflows/01-outlook-finance-acquisition.json", "tests/test_n8n_workflows.py", "runtime/n8n-orchestrator-repo/docs/runtime-health-and-microsoft-refresh.md", "/opt/disposable/finance-n8n/20260819155134/receipts/inactive-00491aae2ab4-20260819T221734Z.json"],
      "tests": ["Outlook server-filter, From-list subworkflow, attachment, and OneDrive binary-upload contracts pass", "runtime readback verified 4 Outlook and 13 OneDrive credential bindings with unchanged ciphertext"],
      "live_readback": "Four Outlook and 13 OneDrive binding occurrences are exact. The transient WF23 execution completed one bounded Outlook read and one OneDrive root read and moved both expired access-token expiries to future values. It did not complete the n8n-only restart, second reads, cleanup, or persistence proof; inline-email PDF rendering also remains unproven.",
      "remaining_work": "Remove the exact WF23 orphan, then rerun the complete expired-before, first-read, n8n-restart and second-read sequence; separately prove live filtering, attachment/original archival, and the fixed inline-email PDF renderer.",
      "blockers_remove": [], "blockers_add": ["WF23_EXACT_CLEANUP_REQUIRED", "MICROSOFT_RESTART_PERSISTENCE_PROOF_REQUIRED", "EMAIL_TO_PDF_RENDERER_REQUIRED"],
      "last_verified": "2026-08-20", "next_action": "Restore the exact 21/0/0 boundary, wait for both expiries to be past, and run the guarded restart proof once without recording credential identifiers or token values."
    },
    {
      "id": "N8N-004", "status": "PARTIAL",
      "implementation_state": "PARTIAL", "verification_state": "RUNTIME_EXACT_SCHEMA_AND_SEED_READBACK_VERIFIED_ACTUAL_READBACK_PENDING",
      "evidence_paths": ["integrations/n8n/data-tables.json", "runtime/n8n-orchestrator-repo/docs/receipts/disposable-n8n-fa8fd58-20260819/cli-runtime-receipt.json", "/opt/disposable/finance-n8n/20260819155134/receipts/inactive-00491aae2ab4-20260819T221734Z.json"],
      "tests": ["WF19 local bootstrap passed with 15 finance Data Tables", "official DataTableService readback verified 15 exact schemas, 7 policy rows, 9 config rows, and exact 00491aa commit binding"],